{"clauses": [{"blocker": {"asserted_not_read": false, "derivation": "base", "fact_type": "dispatch_leg", "ground": true, "index": 0, "kind": "atom", "roles": {"source": {"bound": true, "variable": "$x"}, "target": {"bound": true, "variable": "$y"}}, "sample_count": 1, "samples": "redacted"}, "clause_index": 0, "descent": null, "descent_stopped": "not-derived", "steps": [{"count": 0, "fact_type": "dispatch_leg", "index": 0, "kind": "atom"}], "steps_after_blocker": "not-evaluated"}, {"blocker": {"asserted_not_read": false, "derivation": "derived", "fact_type": "dispatch_reachable", "ground": true, "index": 1, "kind": "atom", "roles": {"source": {"bound": true, "variable": "$z"}, "target": {"bound": true, "variable": "$y"}}, "sample_count": 1, "samples": "redacted"}, "clause_index": 1, "descent": {"clauses": [{"blocker": {"asserted_not_read": false, "derivation": "base", "fact_type": "dispatch_leg", "ground": true, "index": 0, "kind": "atom", "roles": {"source": {"bound": true, "variable": "$x"}, "target": {"bound": true, "variable": "$y"}}, "sample_count": 1, "samples": "redacted"}, "clause_index": 0, "descent": null, "descent_stopped": "not-derived", "steps": [{"count": 0, "fact_type": "dispatch_leg", "index": 0, "kind": "atom"}], "steps_after_blocker": "not-evaluated"}, {"blocker": {"asserted_not_read": false, "derivation": "derived", "fact_type": "dispatch_reachable", "ground": true, "index": 1, "kind": "atom", "roles": {"source": {"bound": true, "variable": "$z"}, "target": {"bound": true, "variable": "$y"}}, "sample_count": 1, "samples": "redacted"}, "clause_index": 1, "descent": {"clauses": [{"blocker": {"asserted_not_read": false, "derivation": "base", "fact_type": "dispatch_leg", "ground": true, "index": 0, "kind": "atom", "roles": {"source": {"bound": true, "variable": "$x"}, "target": {"bound": true, "variable": "$y"}}, "sample_count": 1, "samples": "redacted"}, "clause_index": 0, "descent": null, "descent_stopped": "not-derived", "steps": [{"count": 0, "fact_type": "dispatch_leg", "index": 0, "kind": "atom"}], "steps_after_blocker": "not-evaluated"}, {"blocker": {"asserted_not_read": false, "derivation": "derived", "fact_type": "dispatch_reachable", "ground": true, "index": 1, "kind": "atom", "roles": {"source": {"bound": true, "variable": "$z"}, "target": {"bound": true, "variable": "$y"}}, "sample_count": 1, "samples": "redacted"}, "clause_index": 1, "descent": {"clauses": [{"blocker": {"asserted_not_read": false, "derivation": "base", "fact_type": "dispatch_leg", "ground": true, "index": 0, "kind": "atom", "roles": {"source": {"bound": true, "variable": "$x"}, "target": {"bound": true, "variable": "$y"}}, "sample_count": 1, "samples": "redacted"}, "clause_index": 0, "descent": null, "descent_stopped": "not-derived", "steps": [{"count": 0, "fact_type": "dispatch_leg", "index": 0, "kind": "atom"}], "steps_after_blocker": "not-evaluated"}, {"blocker": {"asserted_not_read": false, "derivation": "base", "fact_type": "dispatch_leg", "ground": false, "index": 0, "kind": "atom", "roles": {"source": {"bound": true, "variable": "$x"}, "target": {"bound": false, "variable": "$z"}}, "sample_count": 1, "samples": "redacted"}, "clause_index": 1, "descent": null, "descent_stopped": "not-derived", "steps": [{"count": 0, "fact_type": "dispatch_leg", "index": 0, "kind": "atom"}], "steps_after_blocker": "not-evaluated"}], "fact_type": "dispatch_reachable", "mode": "row", "order": "declared", "reason": null, "status": "blocked", "unavailable": null, "work": {"binding_cells": 9, "joins": 3, "pre_joins": 15, "probes": 53}}, "descent_stopped": null, "steps": [{"count": 1, "fact_type": "dispatch_leg", "index": 0, "kind": "atom"}, {"count": 0, "fact_type": "dispatch_reachable", "index": 1, "kind": "atom"}], "steps_after_blocker": "not-evaluated"}], "fact_type": "dispatch_reachable", "mode": "row", "order": "declared", "reason": null, "status": "blocked", "unavailable": null, "work": {"binding_cells": 9, "joins": 3, "pre_joins": 15, "probes": 53}}, "descent_stopped": null, "steps": [{"count": 1, "fact_type": "dispatch_leg", "index": 0, "kind": "atom"}, {"count": 0, "fact_type": "dispatch_reachable", "index": 1, "kind": "atom"}], "steps_after_blocker": "not-evaluated"}], "fact_type": "dispatch_reachable", "mode": "row", "order": "declared", "reason": null, "status": "blocked", "unavailable": null, "work": {"binding_cells": 9, "joins": 3, "pre_joins": 15, "probes": 53}}, "descent_stopped": null, "steps": [{"count": 1, "fact_type": "dispatch_leg", "index": 0, "kind": "atom"}, {"count": 0, "fact_type": "dispatch_reachable", "index": 1, "kind": "atom"}], "steps_after_blocker": "not-evaluated"}], "exit_code": 0, "fact_type": "dispatch_reachable", "mode": "row", "order": "declared", "reason": null, "schema_version": "gnd-why-not/1", "status": "blocked", "unavailable": null, "view": "redacted", "work": {"binding_cells": 9, "joins": 3, "pre_joins": 15, "probes": 53}}
