{"clauses": [{"blocker": {"count": 0, "fact_type": "listed", "index": 0, "kind": "negated", "reads": ["$w"], "sample_count": 2, "samples": "redacted"}, "clause_index": 0, "descent": null, "descent_stopped": null, "steps": [{"count": 2, "fact_type": "score", "index": 0, "kind": "atom"}, {"count": 0, "fact_type": "listed", "index": 0, "kind": "negated"}], "steps_after_blocker": "not-evaluated"}], "exit_code": 0, "fact_type": "delisted", "mode": "rule", "order": "declared", "reason": null, "schema_version": "gnd-why-not/1", "status": "blocked", "unavailable": null, "view": "redacted", "work": {"binding_cells": 4, "joins": 2, "pre_joins": 2, "probes": 6}}
